1.0,debug,Enable debug logs.,false
1142.0,server.tomcat.accesslog.suffix,Log file name suffix.,.log
1143.0,server.tomcat.additional-tld-skip-patterns,Comma-separated list of additional patterns that match jars to ignore for TLD scanning. The special '?' and '*' characters can be used in the pattern to match one and only one character and zero or more characters respectively.,
1144.0,server.tomcat.background-processor-delay,"Delay between the invocation of backgroundProcess methods. If a duration suffix is not specified, seconds will be used.",10s
1145.0,server.tomcat.basedir,"Tomcat base directory. If not specified, a temporary directory is used.",
1146.0,server.tomcat.connection-timeout,"Amount of time the connector will wait, after accepting a connection, for the request URI line to be presented.",
1147.0,server.tomcat.keep-alive-timeout,Time to wait for another HTTP request before the connection is closed. When not set the connectionTimeout is used. When set to -1 there will be no timeout.,
1148.0,server.tomcat.max-connections,"Maximum number of connections that the server accepts and processes at any given time. Once the limit has been reached, the operating system may still accept connections based on the ""acceptCount"" property.",8192
1149.0,server.tomcat.max-http-form-post-size,Maximum size of the form content in any HTTP post request.,2MB
1150.0,server.tomcat.max-http-response-header-size,Maximum size of the HTTP response header.,8KB
1151.0,server.tomcat.max-keep-alive-requests,"Maximum number of HTTP requests that can be pipelined before the connection is closed. When set to 0 or 1, keep-alive and pipelining are disabled. When set to -1, an unlimited number of pipelined or keep-alive requests are allowed.",100
1152.0,server.tomcat.max-swallow-size,Maximum amount of request body to swallow.,2MB
1153.0,server.tomcat.mbeanregistry.enabled,Whether Tomcat's MBean Registry should be enabled.,false
1154.0,server.tomcat.processor-cache,Maximum number of idle processors that will be retained in the cache and reused with a subsequent request. When set to -1 the cache will be unlimited with a theoretical maximum size equal to the maximum number of connections.,200
1155.0,server.tomcat.redirect-context-root,"Whether requests to the context root should be redirected by appending a / to the path. When using SSL terminated at a proxy, this property should be set to false.",true
1156.0,server.tomcat.relaxed-path-chars,"Comma-separated list of additional unencoded characters that should be allowed in URI paths. Only ""< > [ \ ] ^ ` { | }"" are allowed.",
1157.0,server.tomcat.relaxed-query-chars,"Comma-separated list of additional unencoded characters that should be allowed in URI query strings. Only ""< > [ \ ] ^ ` { | }"" are allowed.",
1158.0,server.tomcat.remoteip.host-header,Name of the HTTP header from which the remote host is extracted.,X-Forwarded-Host
1159.0,server.tomcat.remoteip.internal-proxies,Regular expression that matches proxies that are to be trusted.,"10\\.\\d{1,3}\\.\\d{1,3}\\.\\d{1,3}|192\\.168\\.\\d{1,3}\\.\\d{1,3}|169\\.254\\.\\d{1,3}\\.\\d{1,3}|127\\.\\d{1,3}\\.\\d{1,3}\\.\\d{1,3}|100\\.6[4-9]{1}\\.\\d{1,3}\\.\\d{1,3}|100\\.[7-9]{1}\\d{1}\\.\\d{1,3}\\.\\d{1,3}|100\\.1[0-1]{1}\\d{1}\\.\\d{1,3}\\.\\d{1,3}|100\\.12[0-7]{1}\\.\\d{1,3}\\.\\d{1,3}|172\\.1[6-9]{1}\\.\\d{1,3}\\.\\d{1,3}|172\\.2[0-9]{1}\\.\\d{1,3}\\.\\d{1,3}|172\\.3[0-1]{1}\\.\\d{1,3}\\.\\d{1,3}|0:0:0:0:0:0:0:1|::1"
1160.0,server.tomcat.remoteip.port-header,Name of the HTTP header used to override the original port value.,X-Forwarded-Port
1161.0,server.tomcat.remoteip.protocol-header,"Header that holds the incoming protocol, usually named ""X-Forwarded-Proto"".",
1162.0,server.tomcat.remoteip.protocol-header-https-value,Value of the protocol header indicating whether the incoming request uses SSL.,https
1163.0,server.tomcat.remoteip.remote-ip-header,"Name of the HTTP header from which the remote IP is extracted. For instance, 'X-FORWARDED-FOR'.",
1164.0,server.tomcat.remoteip.trusted-proxies,"Regular expression defining proxies that are trusted when they appear in the ""remote-ip-header"" header.",
1165.0,server.tomcat.resource.allow-caching,Whether static resource caching is permitted for this web application.,true
1166.0,server.tomcat.resource.cache-ttl,Time-to-live of the static resource cache.,
1167.0,server.tomcat.threads.max,Maximum amount of worker threads.,200
1168.0,server.tomcat.threads.min-spare,Minimum amount of worker threads.,10
1169.0,server.tomcat.uri-encoding,Character encoding to use to decode the URI.,UTF-8
1170.0,server.tomcat.use-relative-redirects,Whether HTTP 1.1 and later location headers generated by a call to sendRedirect will use relative or absolute redirects.,false
1171.0,server.undertow.accesslog.dir,Undertow access log directory.,
1172.0,server.undertow.accesslog.enabled,Whether to enable the access log.,false
1173.0,server.undertow.accesslog.pattern,Format pattern for access logs.,common
1174.0,server.undertow.accesslog.prefix,Log file name prefix.,access_log.
1175.0,server.undertow.accesslog.rotate,Whether to enable access log rotation.,true
1176.0,server.undertow.accesslog.suffix,Log file name suffix.,log
1177.0,server.undertow.always-set-keep-alive,"Whether the 'Connection: keep-alive' header should be added to all responses, even if not required by the HTTP specification.",true
1178.0,server.undertow.buffer-size,Size of each buffer. The default is derived from the maximum amount of memory that is available to the JVM.,
1179.0,server.undertow.decode-slash,"Whether encoded slash characters (%2F) should be decoded. Decoding can cause security problems if a front-end proxy does not perform the same decoding. Only enable this if you have a legacy application that requires it. When set, server.undertow.allow-encoded-slash has no effect.",
1180.0,server.undertow.decode-url,"Whether the URL should be decoded. When disabled, percent-encoded characters in the URL will be left as-is.",true
1181.0,server.undertow.direct-buffers,Whether to allocate buffers outside the Java heap. The default is derived from the maximum amount of memory that is available to the JVM.,
1182.0,server.undertow.eager-filter-init,Whether servlet filters should be initialized on startup.,true
1183.0,server.undertow.max-cookies,Maximum number of cookies that are allowed. This limit exists to prevent hash collision based DOS attacks.,200
1184.0,server.undertow.max-headers,Maximum number of headers that are allowed. This limit exists to prevent hash collision based DOS attacks.,
1185.0,server.undertow.max-http-post-size,"Maximum size of the HTTP post content. When the value is -1, the default, the size is unlimited.",-1B
1186.0,server.undertow.max-parameters,Maximum number of query or path parameters that are allowed. This limit exists to prevent hash collision based DOS attacks.,
1187.0,server.undertow.no-request-timeout,"Amount of time a connection can sit idle without processing a request, before it is closed by the server.",
1188.0,server.undertow.options.server.*,Server options as defined in io.undertow.UndertowOptions.,
1189.0,server.undertow.options.socket.*,Socket options as defined in org.xnio.Options.,
1190.0,server.undertow.preserve-path-on-forward,Whether to preserve the path of a request when it is forwarded.,false
1191.0,server.undertow.threads.io,Number of I/O threads to create for the worker. The default is derived from the number of available processors.,
1192.0,server.undertow.threads.worker,Number of worker threads. The default is 8 times the number of I/O threads.,
1193.0,server.undertow.url-charset,Charset used to decode URLs.,UTF-8
1194.0,spring.security.filter.dispatcher-types,Security filter chain dispatcher types for Servlet-based web applications.,"[async, error, forward, include, request]"
1195.0,spring.security.filter.order,Security filter chain order for Servlet-based web applications.,-100
1196.0,spring.security.oauth2.authorizationserver.client.*,Registered clients of the Authorization Server.,
1197.0,spring.security.oauth2.authorizationserver.endpoint.authorization-uri,Authorization Server's OAuth 2.0 Authorization Endpoint.,/oauth2/authorize
1198.0,spring.security.oauth2.authorizationserver.endpoint.device-authorization-uri,Authorization Server's OAuth 2.0 Device Authorization Endpoint.,/oauth2/device_authorization
1199.0,spring.security.oauth2.authorizationserver.endpoint.device-verification-uri,Authorization Server's OAuth 2.0 Device Verification Endpoint.,/oauth2/device_verification
1200.0,spring.security.oauth2.authorizationserver.endpoint.jwk-set-uri,Authorization Server's JWK Set Endpoint.,/oauth2/jwks
1201.0,spring.security.oauth2.authorizationserver.endpoint.oidc.client-registration-uri,Authorization Server's OpenID Connect 1.0 Client Registration Endpoint.,/connect/register
1202.0,spring.security.oauth2.authorizationserver.endpoint.oidc.logout-uri,Authorization Server's OpenID Connect 1.0 Logout Endpoint.,/connect/logout
1203.0,spring.security.oauth2.authorizationserver.endpoint.oidc.user-info-uri,Authorization Server's OpenID Connect 1.0 UserInfo Endpoint.,/userinfo
1204.0,spring.security.oauth2.authorizationserver.endpoint.token-introspection-uri,Authorization Server's OAuth 2.0 Token Introspection Endpoint.,/oauth2/introspect
1205.0,spring.security.oauth2.authorizationserver.endpoint.token-revocation-uri,Authorization Server's OAuth 2.0 Token Revocation Endpoint.,/oauth2/revoke
1206.0,spring.security.oauth2.authorizationserver.endpoint.token-uri,Authorization Server's OAuth 2.0 Token Endpoint.,/oauth2/token
1207.0,spring.security.oauth2.authorizationserver.issuer,URL of the Authorization Server's Issuer Identifier.,
1208.0,spring.security.oauth2.client.provider.*,OAuth provider details.,
1209.0,spring.security.oauth2.client.registration.*,OAuth client registrations.,
1210.0,spring.security.oauth2.resourceserver.jwt.audiences,Identifies the recipients that the JWT is intended for.,
1211.0,spring.security.oauth2.resourceserver.jwt.issuer-uri,URI that can either be an OpenID Connect discovery endpoint or an OAuth 2.0 Authorization Server Metadata endpoint defined by RFC 8414.,
1212.0,spring.security.oauth2.resourceserver.jwt.jwk-set-uri,JSON Web Key URI to use to verify the JWT token.,
1213.0,spring.security.oauth2.resourceserver.jwt.jws-algorithms,JSON Web Algorithms used for verifying the digital signatures.,RS256
1214.0,spring.security.oauth2.resourceserver.jwt.public-key-location,Location of the file containing the public key used to verify a JWT.,
1215.0,spring.security.oauth2.resourceserver.opaquetoken.client-id,Client id used to authenticate with the token introspection endpoint.,
1216.0,spring.security.oauth2.resourceserver.opaquetoken.client-secret,Client secret used to authenticate with the token introspection endpoint.,
1217.0,spring.security.oauth2.resourceserver.opaquetoken.introspection-uri,OAuth 2.0 endpoint through which token introspection is accomplished.,
1218.0,spring.security.saml2.relyingparty.registration.*,SAML2 relying party registrations.,
1219.0,spring.security.user.name,Default user name.,user
1220.0,spring.security.user.password,Password for the default user name.,
1221.0,spring.security.user.roles,Granted roles for the default user name.,
1222.0,spring.rsocket.server.address,Network address to which the server should bind.,
1223.0,spring.rsocket.server.fragment-size,Maximum transmission unit. Frames larger than the specified value are fragmented.,
1224.0,spring.rsocket.server.mapping-path,Path under which RSocket handles requests (only works with websocket transport).,
1225.0,spring.rsocket.server.port,Server port.,
1226.0,spring.rsocket.server.spec.compress,Whether the websocket compression extension is enabled.,false
1227.0,spring.rsocket.server.spec.handle-ping,Whether to proxy websocket ping frames or respond to them.,false
1228.0,spring.rsocket.server.spec.max-frame-payload-length,Maximum allowable frame payload length.,65536B
1229.0,spring.rsocket.server.spec.protocols,Sub-protocols to use in websocket handshake signature.,
1230.0,spring.rsocket.server.ssl.bundle,The name of a configured SSL bundle.,
1231.0,spring.rsocket.server.ssl.certificate,Path to a PEM-encoded SSL certificate file.,
1232.0,spring.rsocket.server.ssl.certificate-private-key,Path to a PEM-encoded private key file for the SSL certificate.,
1233.0,spring.rsocket.server.ssl.ciphers,Supported SSL ciphers.,
1234.0,spring.rsocket.server.ssl.client-auth,Client authentication mode. Requires a trust store.,
1235.0,spring.rsocket.server.ssl.enabled,Whether to enable SSL support.,true
1236.0,spring.rsocket.server.ssl.enabled-protocols,Enabled SSL protocols.,
1237.0,spring.rsocket.server.ssl.key-alias,Alias that identifies the key in the key store.,
1238.0,spring.rsocket.server.ssl.key-password,Password used to access the key in the key store.,
1239.0,spring.rsocket.server.ssl.key-store,Path to the key store that holds the SSL certificate (typically a jks file).,
1240.0,spring.rsocket.server.ssl.key-store-password,Password used to access the key store.,
1241.0,spring.rsocket.server.ssl.key-store-provider,Provider for the key store.,
1242.0,spring.rsocket.server.ssl.key-store-type,Type of the key store.,
1243.0,spring.rsocket.server.ssl.protocol,SSL protocol to use.,TLS
1244.0,spring.rsocket.server.ssl.trust-certificate,Path to a PEM-encoded SSL certificate authority file.,
1245.0,spring.rsocket.server.ssl.trust-certificate-private-key,Path to a PEM-encoded private key file for the SSL certificate authority.,
1246.0,spring.rsocket.server.ssl.trust-store,Trust store that holds SSL certificates.,
1247.0,spring.rsocket.server.ssl.trust-store-password,Password used to access the trust store.,
1248.0,spring.rsocket.server.ssl.trust-store-provider,Provider for the trust store.,
1249.0,spring.rsocket.server.ssl.trust-store-type,Type of the trust store.,
1250.0,spring.rsocket.server.transport,RSocket transport protocol.,tcp
1251.0,management.appoptics.metrics.export.api-token,AppOptics API token.,
1252.0,management.appoptics.metrics.export.batch-size,"Number of measurements per request to use for this backend. If more measurements are found, then multiple requests will be made.",500
1253.0,management.appoptics.metrics.export.connect-timeout,Connection timeout for requests to this backend.,5s
1254.0,management.appoptics.metrics.export.enabled,Whether exporting of metrics to this backend is enabled.,true
1255.0,management.appoptics.metrics.export.floor-times,"Whether to ship a floored time, useful when sending measurements from multiple hosts to align them on a given time boundary.",false
1256.0,management.appoptics.metrics.export.host-tag,"Tag that will be mapped to ""@host"" when shipping metrics to AppOptics.",instance
1257.0,management.appoptics.metrics.export.read-timeout,Read timeout for requests to this backend.,10s
1258.0,management.appoptics.metrics.export.step,Step size (i.e. reporting frequency) to use.,1m
1259.0,management.appoptics.metrics.export.uri,URI to ship metrics to.,https://api.appoptics.com/v1/measurements
1260.0,management.atlas.metrics.export.batch-size,"Number of measurements per request to use for this backend. If more measurements are found, then multiple requests will be made.",10000
1261.0,management.atlas.metrics.export.config-refresh-frequency,Frequency for refreshing config settings from the LWC service.,10s
1262.0,management.atlas.metrics.export.config-time-to-live,Time to live for subscriptions from the LWC service.,150s
1263.0,management.atlas.metrics.export.config-uri,URI for the Atlas LWC endpoint to retrieve current subscriptions.,http://localhost:7101/lwc/api/v1/expressions/local-dev
1264.0,management.atlas.metrics.export.connect-timeout,Connection timeout for requests to this backend.,1s
1265.0,management.atlas.metrics.export.enabled,Whether exporting of metrics to this backend is enabled.,true
1266.0,management.atlas.metrics.export.eval-uri,URI for the Atlas LWC endpoint to evaluate the data for a subscription.,http://localhost:7101/lwc/api/v1/evaluate
1267.0,management.atlas.metrics.export.lwc-enabled,Whether to enable streaming to Atlas LWC.,false
1268.0,management.atlas.metrics.export.lwc-ignore-publish-step,Whether expressions with the same step size as Atlas publishing should be ignored for streaming. Used for cases where data being published to Atlas is also sent into streaming from the backend.,true
1269.0,management.atlas.metrics.export.lwc-step,Step size (reporting frequency) to use for streaming to Atlas LWC. This is the highest supported resolution for getting an on-demand stream of the data. It must be less than or equal to management.metrics.export.atlas.step and management.metrics.export.atlas.step should be an even multiple of this value.,5s
1270.0,management.atlas.metrics.export.meter-time-to-live,Time to live for meters that do not have any activity. After this period the meter will be considered expired and will not get reported.,15m
1271.0,management.atlas.metrics.export.num-threads,Number of threads to use with the metrics publishing scheduler.,4
1272.0,management.atlas.metrics.export.read-timeout,Read timeout for requests to this backend.,10s
1273.0,management.atlas.metrics.export.step,Step size (i.e. reporting frequency) to use.,1m
1274.0,management.atlas.metrics.export.uri,URI of the Atlas server.,http://localhost:7101/api/v1/publish
1275.0,management.auditevents.enabled,Whether to enable storage of audit events.,true
1276.0,management.cloudfoundry.enabled,Whether to enable extended Cloud Foundry actuator endpoints.,true
1277.0,management.cloudfoundry.skip-ssl-validation,Whether to skip SSL verification for Cloud Foundry actuator endpoint security calls.,false
1278.0,management.datadog.metrics.export.api-key,Datadog API key.,
1279.0,management.datadog.metrics.export.application-key,"Datadog application key. Not strictly required, but improves the Datadog experience by sending meter descriptions, types, and base units to Datadog.",
1280.0,management.datadog.metrics.export.batch-size,"Number of measurements per request to use for this backend. If more measurements are found, then multiple requests will be made.",10000
1281.0,management.datadog.metrics.export.connect-timeout,Connection timeout for requests to this backend.,1s
1282.0,management.datadog.metrics.export.descriptions,Whether to publish descriptions metadata to Datadog. Turn this off to minimize the amount of metadata sent.,true
1283.0,management.datadog.metrics.export.enabled,Whether exporting of metrics to this backend is enabled.,true
1284.0,management.datadog.metrics.export.host-tag,"Tag that will be mapped to ""host"" when shipping metrics to Datadog.",instance
1285.0,management.datadog.metrics.export.read-timeout,Read timeout for requests to this backend.,10s
1286.0,management.datadog.metrics.export.step,Step size (i.e. reporting frequency) to use.,1m
1287.0,management.datadog.metrics.export.uri,"URI to ship metrics to. Set this if you need to publish metrics to a Datadog site other than US, or to an internal proxy en-route to Datadog.",https://api.datadoghq.com
1288.0,management.defaults.metrics.export.enabled,Whether to enable default metrics exporters.,true
1289.0,management.dynatrace.metrics.export.api-token,Dynatrace authentication token.,
1290.0,management.dynatrace.metrics.export.batch-size,"Number of measurements per request to use for this backend. If more measurements are found, then multiple requests will be made.",10000
1291.0,management.dynatrace.metrics.export.connect-timeout,Connection timeout for requests to this backend.,1s
1292.0,management.dynatrace.metrics.export.enabled,Whether exporting of metrics to this backend is enabled.,true
1293.0,management.dynatrace.metrics.export.read-timeout,Read timeout for requests to this backend.,10s
1294.0,management.dynatrace.metrics.export.step,Step size (i.e. reporting frequency) to use.,1m
1295.0,management.dynatrace.metrics.export.uri,"URI to ship metrics to. Should be used for SaaS, self-managed instances or to en-route through an internal proxy.",
1296.0,management.dynatrace.metrics.export.v1.device-id,ID of the custom device that is exporting metrics to Dynatrace.,
1297.0,management.dynatrace.metrics.export.v1.group,Group for exported metrics. Used to specify custom device group name in the Dynatrace UI.,
1298.0,management.dynatrace.metrics.export.v1.technology-type,Technology type for exported metrics. Used to group metrics under a logical technology name in the Dynatrace UI.,java
1299.0,management.dynatrace.metrics.export.v2.default-dimensions.*,Default dimensions that are added to all metrics in the form of key-value pairs. These are overwritten by Micrometer tags if they use the same key.,
1300.0,management.dynatrace.metrics.export.v2.enrich-with-dynatrace-metadata,Whether to enable Dynatrace metadata export.,true
1301.0,management.dynatrace.metrics.export.v2.export-meter-metadata,Whether to export meter metadata (unit and description) to the Dynatrace backend.,true
1302.0,management.dynatrace.metrics.export.v2.metric-key-prefix,Prefix string that is added to all exported metrics.,
1303.0,management.dynatrace.metrics.export.v2.use-dynatrace-summary-instruments,Whether to fall back to the built-in micrometer instruments for Timer and DistributionSummary.,true
1304.0,management.elastic.metrics.export.api-key-credentials,Base64-encoded credentials string. Mutually exclusive with user-name and password.,
1305.0,management.elastic.metrics.export.auto-create-index,Whether to create the index automatically if it does not exist.,true
1306.0,management.elastic.metrics.export.batch-size,"Number of measurements per request to use for this backend. If more measurements are found, then multiple requests will be made.",10000
1307.0,management.elastic.metrics.export.connect-timeout,Connection timeout for requests to this backend.,1s
1308.0,management.elastic.metrics.export.enabled,Whether exporting of metrics to this backend is enabled.,true
1309.0,management.elastic.metrics.export.host,Host to export metrics to.,http://localhost:9200
1310.0,management.elastic.metrics.export.index,Index to export metrics to.,micrometer-metrics
1311.0,management.elastic.metrics.export.index-date-format,Index date format used for rolling indices. Appended to the index name.,yyyy-MM
1312.0,management.elastic.metrics.export.index-date-separator,Prefix to separate the index name from the date format used for rolling indices.,-
1313.0,management.elastic.metrics.export.password,Login password of the Elastic server. Mutually exclusive with api-key-credentials.,
1314.0,management.elastic.metrics.export.pipeline,"Ingest pipeline name. By default, events are not pre-processed.",
1315.0,management.elastic.metrics.export.read-timeout,Read timeout for requests to this backend.,10s
1316.0,management.elastic.metrics.export.step,Step size (i.e. reporting frequency) to use.,1m
1317.0,management.elastic.metrics.export.timestamp-field-name,Name of the timestamp field.,@timestamp
1318.0,management.elastic.metrics.export.user-name,Login user of the Elastic server. Mutually exclusive with api-key-credentials.,
1319.0,management.endpoint.auditevents.cache.time-to-live,Maximum time that a response can be cached.,0ms
1320.0,management.endpoint.auditevents.enabled,Whether to enable the auditevents endpoint.,true
1321.0,management.endpoint.beans.cache.time-to-live,Maximum time that a response can be cached.,0ms
1322.0,management.endpoint.beans.enabled,Whether to enable the beans endpoint.,true
1323.0,management.endpoint.caches.cache.time-to-live,Maximum time that a response can be cached.,0ms
1324.0,management.endpoint.caches.enabled,Whether to enable the caches endpoint.,true
1325.0,management.endpoint.conditions.cache.time-to-live,Maximum time that a response can be cached.,0ms
1326.0,management.endpoint.conditions.enabled,Whether to enable the conditions endpoint.,true
1327.0,management.endpoint.configprops.cache.time-to-live,Maximum time that a response can be cached.,0ms
1328.0,management.endpoint.configprops.enabled,Whether to enable the configprops endpoint.,true
1329.0,management.endpoint.configprops.roles,"Roles used to determine whether a user is authorized to be shown unsanitized values. When empty, all authenticated users are authorized.",
1330.0,management.endpoint.configprops.show-values,When to show unsanitized values.,never
1331.0,management.endpoint.env.cache.time-to-live,Maximum time that a response can be cached.,0ms
1332.0,management.endpoint.env.enabled,Whether to enable the env endpoint.,true
1333.0,management.endpoint.env.roles,"Roles used to determine whether a user is authorized to be shown unsanitized values. When empty, all authenticated users are authorized.",
1334.0,management.endpoint.env.show-values,When to show unsanitized values.,never
1335.0,management.endpoint.flyway.cache.time-to-live,Maximum time that a response can be cached.,0ms
1336.0,management.endpoint.flyway.enabled,Whether to enable the flyway endpoint.,true
1337.0,management.endpoint.health.cache.time-to-live,Maximum time that a response can be cached.,0ms
1338.0,management.endpoint.health.enabled,Whether to enable the health endpoint.,true
1339.0,management.endpoint.health.group.*,Health endpoint groups.,
1340.0,management.endpoint.health.logging.slow-indicator-threshold,Threshold after which a warning will be logged for slow health indicators.,10s
1341.0,management.endpoint.health.probes.add-additional-paths,Whether to make the liveness and readiness health groups available on the main server port.,false
1342.0,management.endpoint.health.probes.enabled,Whether to enable liveness and readiness probes.,false
1343.0,management.endpoint.health.roles,"Roles used to determine whether a user is authorized to be shown details. When empty, all authenticated users are authorized.",
